{
  "$schema": "https://json-schema.org/draft/2020-12/schema",
  "$id": "https://github.com/open-coder-ai/agentseam/blob/main/src/agentseam/data/recordings/schema.json",
  "title": "agentseam recorded driver: a frozen witness run",
  "description": "One file per (agent, version) -- data/recordings/<agent>@<version>.json -- written by tools/experiment.py --record from a real agent, never by hand and never edited after landing: a newer version is a new file, not a rewrite of this one (owner decision 2026-09-07, org-plan plan/agentseam-project.md 'Evidence layer'). `tools/recorded_driver.py` replays it through the same tools/experiment.py classifier a live run would have used, so `--driver recorded` reproduces the witnessed table without launching a process. Facts only: `notes` is the one line of prose this file allows.",
  "type": "object",
  "additionalProperties": false,
  "required": [
    "agent",
    "version",
    "platform",
    "date",
    "driver",
    "events"
  ],
  "properties": {
    "agent": {
      "type": "string",
      "pattern": "^[a-z][a-z0-9_]*$"
    },
    "version": {
      "type": "string",
      "minLength": 1
    },
    "platform": {
      "type": "string",
      "minLength": 1
    },
    "date": {
      "type": "string",
      "pattern": "^\\d{4}-\\d{2}-\\d{2}$"
    },
    "driver": {
      "enum": [
        "real-agent"
      ],
      "description": "Always real-agent: the same invariant evidence_report.py enforces on a submitted report -- only a running agent may freeze a witness recording."
    },
    "reporter": {
      "type": "string",
      "minLength": 1
    },
    "notes": {
      "type": "string",
      "minLength": 1,
      "description": "One line. The why belongs in the PR body, not here."
    },
    "events": {
      "type": "object",
      "minProperties": 1,
      "description": "Canonical event name -> what was witnessed there. A key present here IS the claim 'this gate was measured'; a gate this agent claims but this file omits was simply not run yet -- that is the partial-recording case, not an error.",
      "additionalProperties": {
        "$ref": "#/$defs/eventRecord"
      }
    }
  },
  "$defs": {
    "eventRecord": {
      "type": "object",
      "additionalProperties": false,
      "required": [
        "trials",
        "payload_keys"
      ],
      "properties": {
        "payload_keys": {
          "type": "array",
          "items": {
            "type": "string",
            "minLength": 1
          },
          "description": "Every payload key seen across this event's trials, sorted and deduplicated -- the wire shape at this gate, not a per-trial value."
        },
        "trials": {
          "type": "object",
          "minProperties": 1,
          "description": "Trial name (tools/experiment_probe.py's BEHAVIOURS, plus escalate when run) -> the sentinel and invocation counts witnessed. Not the classified outcome itself: replaying these through experiment._classify is what keeps a recording's semantics identical to a live run's, rather than merely similar.",
          "additionalProperties": {
            "$ref": "#/$defs/trialRecord"
          }
        }
      }
    },
    "trialRecord": {
      "type": "object",
      "additionalProperties": false,
      "required": [
        "observed",
        "hook_invocations"
      ],
      "properties": {
        "observed": {
          "type": "object",
          "additionalProperties": false,
          "required": [
            "runs",
            "alt_runs"
          ],
          "properties": {
            "runs": {
              "type": "number"
            },
            "alt_runs": {
              "type": "number"
            }
          }
        },
        "hook_invocations": {
          "type": "number",
          "description": "How many times the hook fired for this trial. At the stop gate this is the re-fire count, capped by the harness's own max_continuations -- not a raw wall-clock count."
        }
      }
    }
  }
}
